Id,Created,Answered,Title,Description
63922234,2020-09-16,2023-09-17,IMarkupExtension with bindable properties,Demonstrates how to use a custom MarkupExtension to create a FontImageSource with bindable properties.
74319669,2022-11-04,2023-09-17,How to create markup extensions having bindable properties?,Demonstrates how to use a custom MarkupExtension to create a RgbColorExtension with bindable properties.
75572430,2023-02-26,2023-07-30,Concatenate Bold Text with Binding Text in Maui Label,Shows how to use Label.FormattedText for cross-platform style.
79696605,2025-07-10,2025-10-09,Can't pass bound view model as command parameter,Shows how subclassing can simplify binding issues.
79717893,2025-07-28,2025-08-03,How to create a re-useable ContentView as a base view?,Demonstrates ContentPage.ControlTemplate.
79772080,2025-09-23,2025-09-23,Why does my .NET MAUI image cross grid cell boundaries?,Shows how to use Grid and Image controls with scaling.
79774725,2025-09-25,2025-10-08,MAUI ZXing.Net.Maui.Controls hide camera is not working,Shows how to use ContentView to control the visibility of CameraBarcodeReaderView.
